id,question,relevance_score,utilization_score,completeness_score,adherence_score,response
QBIOMEDINC_04_08_2020-EX-99.1-JOINT FILING AGREEMENT__Most Favored Nation,"Is there a clause that if a third party gets better terms on the licensing or sale of technology/goods/services described in the contract, the buyer of such technology/goods/services under the contract shall be entitled to those better terms?",0.2727272727272727,0.19696969696969696,0.7222222222222222,0.0,"Based on the context documents, I did not find a specific clause that guarantees a buyer shall be entitled to better terms if a third party gets those terms. However, I did find a few clauses that come close to addressing related concepts:

In Document 4, Section 3.2(A)(ii), it states that the per-processor runtime license fees for any ""Supported Processor"" shall be the same as that specified in Exhibit C for the TI TMS320C54x. This suggests that D2 will offer the same terms to LICENSEE for a new processor as it does for an existing one.

In Document 1, Section 2.5(a), it states that Manufacturer shall not be liable for any failure to perform or any delays in performance, including raw material price increases. While this does not directly address the concept of better terms, it does suggest that Manufacturer's obligations may be affected by changes in external factors such as raw material prices.

In Document 4, Section 3.1, it states that if LICENSEE requires any additional functionality or technology substantially different from those set forth in Exhibit A, D2 shall license such additional functionality or technology to LICENSEE at D2's then best price to its other Licensees. However, this clause does"
MEDIWOUNDLTD_01_15_2014-EX-10.6-SUPPLY AGREEMENT__No-Solicit Of Customers,"Is a party restricted from contracting or soliciting customers or partners of the counterparty, whether during the contract or after the contract ends (or both)?",0.1016949152542373,0.1016949152542373,1.0,0.0,"Based on the provided context documents, there are some restrictions on contracting or soliciting customers or partners of the counterparty. 

Document 3 (Non-Solicitation) states that each Party agrees not to solicit, interfere with, procure or entice away any employee or contractor of the other Party, either directly or indirectly, for a period of six (6) months after the end of the Agreement.

Document 9 (Non-Circumvention) states that each Party agrees not to engage in business dealings, discussions, or otherwise work directly with any third parties introduced to them through the other Party, or to exploit any pre-existing relationship of the other Party with any third party, without the prior consent and/or direct participation of the other Party.

Document 7 (Assignment, Non-Solicitation, and Non-Circumvention) in Document 4 states that upon termination of the Agreement, SCIEN and HEMISPHERX shall not solicit any business from any customer or client of the other party.

Document 5 (Termination) states that upon termination, MBE shall not solicit any business from any customer or client of the Company.

However, it is worth noting that these restrictions do not explicitly state that the parties are restricted from contracting or soliciting customers"
IMAGEWARESYSTEMSINC_12_20_1999-EX-10.22-MAINTENANCE AGREEMENT__Liquidated Damages,Does the contract contain a clause that would award either party liquidated damages for breach or a fee upon the termination of a contract (termination fee)?,0.2,0.05714285714285714,0.14285714285714285,1.0,"Based on the provided context documents, there is no explicit clause that awards either party liquidated damages for breach or a fee upon the termination of a contract (termination fee). However, in some of the documents, there are clauses that imply the continuation of certain obligations and fees after termination, but these are not necessarily related to liquidated damages or termination fees.

For example, in Document 3, it is mentioned that ""During the Termination Period each party will continue to perform its obligations hereunder, and MBE and MBE Centers will continue to pay any applicable fees and payments hereunder to the Company.""

In Document 5, it is mentioned that ""Sections 1, 7, 10, 13, 14, 15, 16 and 18, as well as any payments accrued prior to termination of this Agreement, shall survive any termination or expiration of this Agreement.""

However, these clauses do not explicitly mention liquidated damages or termination fees. If you are looking for a specific clause that awards liquidated damages or a termination fee, it is not present in the provided context documents."
PFSFUNDS_06_26_2020-EX-99.H OTH MAT CONT-SERVICES AGREEMENT__Exclusivity,"Is there an exclusive dealing  commitment with the counterparty? This includes a commitment to procure all “requirements” from one party of certain technology, goods, or services or a prohibition on licensing or selling technology, goods or services to third parties, or a prohibition on  collaborating or working with other parties), whether during the contract or  after the contract ends (or both).",0.18181818181818182,0.18181818181818182,1.0,0.0,"Based on the provided documents, there is no explicit exclusive dealing commitment between the parties. Document 3 mentions that nothing in the Agreement shall create or imply an association, partnership, or joint venture between the Parties, and that the Parties are independent contractors. However, it does not mention any specific commitment to procure all requirements from one party or any prohibition on licensing or selling technology, goods, or services to third parties.

Moreover, Document 1 (Miscellaneous) states that Members will not be jointly or severally liable for the actions of the other Members, and that Members will not be agents for any other Member, indicating that the parties are independent and not committed to exclusive dealing.

Similarly, Document 4 mentions that each Party shall use commercially reasonable efforts to minimize Service Taxes, but it does not contain any language suggesting an exclusive dealing commitment.

Therefore, based on the information provided in the documents, there does not appear to be an exclusive dealing commitment with the counterparty."
AlliedEsportsEntertainmentInc_20190815_8-K_EX-10.34_11788308_EX-10.34_Sponsorship Agreement__Irrevocable Or Perpetual License,Does the contract contain a  license grant that is irrevocable or perpetual?,0.8333333333333334,0.02564102564102564,0.03076923076923077,0.0,"Based on the context documents provided, there is no information that suggests the license grant is irrevocable or perpetual. In fact, Document 3 mentions that ""Nothing in this Agreement shall obligate Licensee to distribute, exhibit or otherwise use any Title."" This suggests that the license grant may be subject to certain conditions or limitations that could potentially be terminated or revoked.

Additionally, Document 4 states that ""Nothing in this Agreement limits or restricts Licensee from entering into any similar agreements with any third party."" This implies that the license grant may not be exclusive or perpetual, and that Licensee may be free to enter into similar agreements with other parties.

Therefore, based on the information provided, it appears that the contract does not contain a license grant that is irrevocable or perpetual."
"CARDAX,INC_08_19_2014-EX-10.1-COLLABORATION AGREEMENT__Non-Disparagement",Is there a requirement on a party not to disparage the counterparty?,0.0,0.0,0.0,1.0,"There is no specific requirement in the provided context documents for a party not to disparage the counterparty. Documents 1, 2, 3, 4, and 5 cover various topics such as liability, assignment, and dispute resolution, but none of them mention anything about disparagement."
"ADUROBIOTECH,INC_06_02_2020-EX-10.7-CONSULTING AGREEMENT__Source Code Escrow","Is one party required to deposit its source code into escrow with a third party, which can be released to the counterparty upon the occurrence of certain events (bankruptcy,  insolvency, etc.)?",0.0,0.0,0.0,1.0,"Based on the provided context documents, there is no information that suggests one party is required to deposit its source code into escrow with a third party to be released to the counterparty upon certain events such as bankruptcy or insolvency."
"BORROWMONEYCOM,INC_06_11_2020-EX-10.1-JOINT VENTURE AGREEMENT__Warranty Duration","What is the duration of any  warranty against defects or errors in technology, products, or services  provided under the contract?",0.05405405405405406,0.06756756756756757,1.0,1.0,"Unfortunately, the provided context documents do not specify a duration for the warranty against defects or errors in technology, products, or services. The documents mention various types of warranties, indemnities, and obligations, but none of them provide information about the duration of these warranties.

Document 3 mentions that if any Product, Work Product, or service furnished under this Agreement becomes the subject of a claim, suit, or proceeding, the Supplier shall take certain actions to secure for Bank of America the right to continue using the Work Product or Product, or to replace or modify it. However, it does not specify a time limit for this warranty.

Document 4 mentions that Subcontractor will provide Manufacturer with documentation substantiating any Product Cost variance upon request, but it does not mention a warranty against defects or errors.

Document 5 mentions that Pretzel Time and Franchisee have various obligations that survive the expiration or termination of the Agreement, but it does not specify a warranty against defects or errors.

Therefore, I cannot provide a specific answer to the question about the duration of any warranty against defects or errors in technology, products, or services provided under the contract."
AlliedEsportsEntertainmentInc_20190815_8-K_EX-10.34_11788308_EX-10.34_Sponsorship Agreement__Document Name,The name of the contract,0.0,0.0,0.0,1.0,I don't have enough information to determine the name of the contract from the provided context documents.
"Zounds Hearing, Inc. - MANUFACTURING DESIGN MARKETING AGREEMENT__No-Solicit Of Customers","Is a party restricted from contracting or soliciting customers or partners of the counterparty, whether during the contract or after the contract ends (or both)?",0.05084745762711865,0.03389830508474576,0.6666666666666666,1.0,"Based on the provided context documents, there are restrictions on contracting or soliciting customers or partners of the counterparty in certain situations.

In Document 3, Section 9. NON-CIRCUMVENTION, it is stated that:

- W2E agrees not to engage in business dealings, discussions, or otherwise work directly with any third parties introduced to W2E through SHBV, or to exploit any pre-existing relationship of SHBV with any third party that has been represented to W2E by SHBV, without the prior consent and/or direct participation of SHBV.
- SHBV agrees not to engage in business dealings, discussions, or otherwise work directly with any third parties introduced to SHBV through W2E, or to exploit any pre-existing relationship of W2E with any third party that has been represented to SHBV by W2E, without the prior consent and/or direct participation of W2E.

This suggests that the parties are restricted from directly engaging with third parties introduced by the counterparty or exploiting pre-existing relationships without the counterparty's consent.

In Document 4, Section NON-SOLICITATION, it is stated that:

- Each Party agrees that during the Term of this Agreement and for a period of six (6) months"
"BORROWMONEYCOM,INC_06_11_2020-EX-10.1-JOINT VENTURE AGREEMENT__Covenant Not To Sue",Is a party restricted from contesting the validity of the counterparty’s ownership of intellectual property or otherwise bringing a claim against the counterparty for matters unrelated to the contract?,0.0684931506849315,0.0684931506849315,1.0,0.0,"Based on the provided context documents, it appears that a party is generally restricted from challenging or assisting others to challenge the counterparty's intellectual property ownership. However, the specific documents do not explicitly state whether a party is restricted from contesting the validity of the counterparty's ownership of intellectual property or bringing claims unrelated to the contract.

Document 1 mentions that a party shall not ""challenge or assist others to challenge the other party's Intellectual Property or the registration thereof"" (Section 5.3). However, it does not explicitly address claims unrelated to the contract.

Document 2 does mention that a party may elect to continue the prosecution of Joint IP Rights, but it does not address the issue of contesting the validity of ownership or bringing unrelated claims.

Document 5 (Section 10) states that each party retains its pre-existing intellectual property rights and may make improvements, enhancements, or modifications to its own intellectual property. However, it does not address the issue of challenging the counterparty's ownership or bringing unrelated claims.

Therefore, based on the provided context, it is unclear whether a party is restricted from contesting the validity of the counterparty's ownership of intellectual property or bringing claims unrelated to the contract."
"OMINTO,INC_03_29_2004-EX-10-RESELLER AGREEMENT__Minimum Commitment",Is there a minimum order size or minimum amount or units per-time period that one party must buy from the counterparty under the contract?,0.0,0.0,0.0,1.0,There is no information in the provided context documents that specifies a minimum order size or minimum amount or units per-time period that one party must buy from the counterparty under the contract.
EbixInc_20010515_10-Q_EX-10.3_4049767_EX-10.3_Co-Branding Agreement__No-Solicit Of Employees,"Is there a restriction on a party’s soliciting or hiring employees and/or contractors from the  counterparty, whether during the contract or after the contract ends (or both)?",0.03333333333333333,0.03333333333333333,1.0,0.0,"Based on the provided context documents, there are restrictions on a party's soliciting or hiring employees and/or contractors from the counterparty in the following scenarios:

1. Document 1 does not explicitly mention restrictions on soliciting or hiring employees.
2. Document 2 does not explicitly mention restrictions on soliciting or hiring contractors.
3. Document 3 (NON-SOLICITATION OF EMPLOYEES) restricts both parties from hiring or allowing their affiliates to hire any employee of the other party, or any person who was an employee of the other party during the previous six months and was directly involved in the provision of services under the agreement. This restriction applies during the term of the agreement and for a period of one year thereafter.
4. Document 4 (NON-SOLICITATION) restricts both parties from soliciting or interfering with employees or contractors of the other party during the term of the agreement and for a period of six months thereafter.
5. Document 5 does not explicitly mention restrictions on soliciting or hiring employees or contractors.

Therefore, the restrictions on soliciting or hiring employees and/or contractors from the counterparty are:

- Document 3: one year after the agreement ends
- Document 4: six months after the agreement ends"
BellringBrandsInc_20190920_S-1_EX-10.12_11817081_EX-10.12_Manufacturing Agreement3__Notice Period To Terminate Renewal,What is the notice period required to terminate renewal?,0.017241379310344827,0.017241379310344827,1.0,1.0,"According to Document 3, ""Either party may terminate the Agreement on 60-days written notice during a renewed term."""
SYKESHEALTHPLANSERVICESINC_04_24_1998-EX-10.14-OUTSOURCING AGREEMENT__Covenant Not To Sue,Is a party restricted from contesting the validity of the counterparty’s ownership of intellectual property or otherwise bringing a claim against the counterparty for matters unrelated to the contract?,0.136986301369863,0.1232876712328767,0.9,0.0,"The provided context does not explicitly state whether a party is restricted from contesting the validity of the counterparty's ownership of intellectual property or otherwise bringing a claim against the counterparty for matters unrelated to the contract.

However, there are some related provisions that might be relevant:

- Document 1, Section 5.3, requires a party not to challenge or assist others to challenge the other party's Intellectual Property or the registration thereof.
- Document 2, Section 5.9, (a) states that each party may enforce the Patents or other intellectual property rights it solely owns, but does not explicitly address the validity of the counterparty's ownership of intellectual property. However, Section 5.9 (b) does state that the parties shall confer and consult before taking any action to enforce or defend any Joint IP.
- Document 5, Section 10.4, requires each party to indemnify the other party against all costs, claims, losses, expenses, and damages incurred by the other party as a result of any infringement by that party of the other party's Intellectual Property Rights.

It seems that a party is restricted from challenging the counterparty's intellectual property rights within the context of the contract, especially when it comes to joint IP. However,"
NETGROCERINC_07_31_1998-EX-10.15-SPONSORSHIP AGREEMENT__Non-Disparagement,Is there a requirement on a party not to disparage the counterparty?,0.0,0.0,0.0,1.0,There is no specific requirement or clause that prohibits a party from disparaging the counterparty in the provided context documents.
"WASTE2ENERGYHOLDINGS,INC_06_03_2010-EX-10.2-STRATEGIC ALLIANCE AGREEMENT__Source Code Escrow","Is one party required to deposit its source code into escrow with a third party, which can be released to the counterparty upon the occurrence of certain events (bankruptcy,  insolvency, etc.)?",0.0,0.0,0.0,1.0,"Based on the provided context documents, there is no mention of a requirement for one party to deposit its source code into escrow with a third party that can be released to the counterparty upon the occurrence of certain events (bankruptcy, insolvency, etc.)."
PLAYAHOTELS_RESORTSNV_03_14_2017-EX-10.22-STRATEGIC ALLIANCE AGREEMENT (Hyatt Ziva Cancun)__Exclusivity,"Is there an exclusive dealing  commitment with the counterparty? This includes a commitment to procure all “requirements” from one party of certain technology, goods, or services or a prohibition on licensing or selling technology, goods or services to third parties, or a prohibition on  collaborating or working with other parties), whether during the contract or  after the contract ends (or both).",0.06493506493506493,0.03896103896103896,0.6,1.0,"Based on the provided context documents, there is no explicit exclusive dealing commitment with the counterparty. Document 1 mentions that ""Members will not be jointly or severally liable for the actions of the other Members"" (Section 60) and that ""Members will provide services to one another on an arms' length basis while remaining independent business entities"" (Section 60). This suggests that the parties are not making any commitments to procure all requirements from one party or to refrain from working with other parties.

However, Document 3 mentions that ""nothing in this Agreement shall create or imply an association, partnership, or joint venture between the Parties, it being agreed and understood that the Parties are independent contractors"" (Section 14.3). This also implies that the parties are not making any exclusive commitments to each other.

Overall, based on the provided context, it appears that there is no exclusive dealing commitment with the counterparty."
ArtaraTherapeuticsInc_20200110_8-K_EX-10.5_11943350_EX-10.5_License Agreement__Termination For Convenience,Can a party terminate this  contract without cause (solely by giving a notice and allowing a waiting  period to expire)?,0.11666666666666667,0.11666666666666667,1.0,0.0,"Based on the provided context documents, the answer is that it is possible for a party to terminate the contract without cause, but the specific conditions and waiting periods vary.

In Document 1, it is stated that the contract may be terminated ""without any liability or obligation of the terminating party"" if the other party breaches any of its obligations in any material respect, which is not remedied within 30 days following written notice. However, this is a termination for cause.

Document 2 states that a party may terminate the contract ""without prejudice to any right or remedy"" if a petition is presented or a proceeding is commenced for the winding-up, insolvency, administration, reorganisation, reconstruction, dissolution, or bankruptcy of the other party. This appears to be a termination without cause.

Document 3 does not explicitly state that a party can terminate the contract without cause, but it does state that either party may cancel the contract if it becomes evident that the other party will commit a breach of contract entitling to cancellation. This is a termination based on the anticipation of a future breach, rather than an existing breach.

Document 4 states that a party may terminate the contract without prejudice to any right or remedy if the other party institutes a bankruptcy proceeding or is made a defendant in"
"MFAFINANCIAL,INC_07_06_2020-EX-99.D-JOINT FILING AGREEMENT__Document Name",The name of the contract,0.0,0.0,0.0,0.0,"Based on the available documents, it is difficult to determine the name of the contract as none of the documents explicitly state the name of the contract.

However, based on the context, it appears that Document 1 is a contract between North and Company, Document 3 is a contract between Pretzel Time and Franchisee, and Document 5 is a contract between Manufacturer and Subcontractor.

Document 1 is likely a contract related to an endorsement or promotional agreement between North and Company, Document 3 is a contract related to a franchise agreement between Pretzel Time and Franchisee, and Document 5 is a contract related to a manufacturing or supply agreement between Manufacturer and Subcontractor.

If you provide more context or information, I may be able to help you identify the name of the contract."
PrecheckHealthServicesInc_20200320_8-K_EX-99.2_12070169_EX-99.2_Distributor Agreement__Parties,The two or more parties who signed the contract,0.04054054054054054,0.04054054054054054,1.0,1.0,"The two parties who signed the contract are:

1.  EcoScience Solutions, Inc. (Sponsor) - Signed by Jeffery Taylor, CEO
2. Fruit of Life Productions LLC (Promoter) - Signed by Stella McLaughlan, Event Coordinator"
Cerus Corporation - FIRST AMEND TO SUPPLY AND MANUFACTURING AGREEMENT__Parties,The two or more parties who signed the contract,0.9594594594594594,0.7297297297297297,0.7605633802816901,0.0,"Based on the documents provided, it appears that there are multiple contracts, each with different parties involved.

Document 1 mentions two parties:
1. Fruit of Life Productions LLC (Promoter)
2. EcoScience Solutions, Inc. (Sponsor)

Document 2 mentions two parties:
1. The Company (no specific name mentioned)
2. The other party (no specific name mentioned, but referred to as the ""other party"")

Document 3 mentions two parties:
1. The Company (no specific name mentioned)
2. The other party (no specific name mentioned, but referred to as the ""other party"")

Document 4 mentions two parties:
1. Stryker
2. Conformis, Inc.

Document 5 mentions two parties:
1. The assignor (no specific name mentioned)
2. The other party (no specific name mentioned)

Therefore, it is not possible to identify the specific two or more parties who signed the contract based on the provided documents, as there are multiple contracts with different parties involved."
PacificapEntertainmentHoldingsInc_20051115_8-KA_EX-1.01_4300894_EX-1.01_Content License Agreement__Third Party Beneficiary,Is there a non-contracting party who is a beneficiary to some or all of the clauses in the contract and therefore can enforce its rights against a contracting party?,0.1,0.15714285714285714,1.0,0.0,"Based on the provided context documents, there are no clear indications of non-contracting parties being beneficiaries to some or all of the clauses in the contract. However, there are some mentions of beneficiaries and third-party beneficiaries.

In Document 4, it is mentioned that the Agreement is intended to be for the sole and exclusive benefit of the Agent, the Company, the MHCs, and the Bank and their respective successors, and said controlling persons, partners, officers, and directors and their heirs, partners, legal representatives. This suggests that some parties not directly involved in the contract may have some level of benefit or protection.

In Document 1, it is mentioned that the parties acknowledge that money damages alone would be an inadequate remedy for the injuries and damage that would be suffered and incurred by the non-breaching party as a result of a breach of any of the provisions of this Agreement. This section does not explicitly mention any non-contracting parties as beneficiaries.

In Document 2, it is mentioned that the prevailing party (as determined by the court) shall be entitled to payment by the non-prevailing party of all costs and expenses (including reasonable attorneys' fees) incurred by the prevailing party. This section does not explicitly mention any non-contracting parties as beneficiaries."
