id,question,relevance_score,utilization_score,completeness_score,adherence_score,response
SMITHELECTRICVEHICLESCORP_04_04_2012-EX-10.26-FLEET MAINTENANCE AGREEMENT__Effective Date,The date when the contract is effective ,0.014084507042253521,0.014084507042253521,1.0,1.0,"Based on the provided context documents, I can find the effective date of the contract in Document 4: SPONSORSHIP AGREEMENT.

The effective date of the contract is stated as: 
""This agreement (the ""Agreement"") is made effective this 1st day of April, 2018 (""Effective Date"")."""
QBIOMEDINC_04_08_2020-EX-99.1-JOINT FILING AGREEMENT__Renewal Term,What is the renewal term after the initial term expires? This includes automatic extensions and unilateral extensions with prior notice.,0.08823529411764706,0.058823529411764705,0.6666666666666666,0.0,"Based on the provided context documents, here are the renewal terms mentioned:

Document 1: The agreement will automatically renew for successive 1-year periods if agreed by both parties in writing within 30 days of license expiration.

Document 2: The agreement will automatically renew for additional periods of **** (Renewal Term) unless a Party provides written notification of non-renewal to the other Party at least **** of the Initial Term or a Renewal Term.

Document 3: The agreement will automatically renew for consecutive one (1) year terms at XIMAGE's then prevailing rates at the end of each one (1) year term unless either party gives at least sixty (60) days prior written notice of the non-renewal of this Agreement.

Document 4: The agreement may be extended for up to three (3) additional periods of twelve (12) months (each, an ""Extension Period"") by written notice given by Customer to Manufacturer not less than twelve (12) months prior to the expiration of the Initial Term or the applicable Extension Period.

Document 5 is not relevant to this question.

However, there is no explicit information on the length of the renewal terms in some documents. For Document 1 and Document 3, the renewal term is explicitly stated"
UpjohnInc_20200121_10-12G_EX-2.6_11948692_EX-2.6_Manufacturing Agreement_ Supply Agreement__Covenant Not To Sue,Is a party restricted from contesting the validity of the counterparty’s ownership of intellectual property or otherwise bringing a claim against the counterparty for matters unrelated to the contract?,0.1095890410958904,0.0410958904109589,0.375,0.0,"Based on the provided context documents, it appears that there are some restrictions on contesting the validity of the counterparty's ownership of intellectual property or bringing claims against the counterparty, but it's not a straightforward answer.

In Document 1, Section 5.3, it is stated that ""At no time during or after the Term of this Agreement shall a party challenge or assist others to challenge the other party's Intellectual Property or the registration thereof or attempt to register any trademarks, marks or trade names confusingly similar to those of the other party.""

However, Document 2, Section 5.8, and Document 3 indicate that a party may be able to challenge or bring claims against the counterparty in certain circumstances. For example, in Document 2, Section 5.8, it is stated that if a party decides not to file or maintain a patent application, the other party may elect to continue prosecution at its own expense, and if a dispute arises, the parties may confer and consult with each other. Similarly, in Document 3, it is stated that if Janssen obtains a license to intellectual property from a third party due to a claim or suit against it, Company shall provide reasonable cooperation to Janssen in procuring and complying"
BOLIVARMININGCORP_05_23_2003-EX-2.1-VISP WEB SITE BUILDING AND HOSTING AGREEMENT__Minimum Commitment,Is there a minimum order size or minimum amount or units per-time period that one party must buy from the counterparty under the contract?,0.0,0.0,0.0,1.0,There is no information in the provided context documents about a minimum order size or a minimum amount or units per-time period that one party must buy from the counterparty under the contract.
IdeanomicsInc_20160330_10-K_EX-10.26_9512211_EX-10.26_Content License Agreement__Effective Date,The date when the contract is effective ,0.014084507042253521,0.0,0.0,0.0,I'm unable to answer your question because there is no clear information in the provided context documents about the date when the contract is effective.
ALLIANCEBANCORPINCOFPENNSYLVANIA_10_18_2006-EX-1.2-AGENCY AGREEMENT__Rofr/Rofo/Rofn,"Is there a clause granting one party a right of first refusal, right of first offer or right of first negotiation to purchase, license, market, or distribute equity interest, technology, assets, products or services?",0.08955223880597014,0.05970149253731343,0.3333333333333333,0.0,"Based on the provided context documents, there is no explicit clause granting one party a right of first refusal, right of first offer, or right of first negotiation to purchase, license, market, or distribute equity interest, technology, assets, products, or services.

However, Document 3 mentions a clause where a party may disclose the terms of this Agreement to a Third Party (and its professional advisors) when such disclosure is reasonably necessary in connection with (A) the grant of a license or sublicense to such Third Party, but this does not indicate a right of first refusal or negotiation.

Document 1 and Document 4 do not mention such a clause, and the other documents do not contain any information that would suggest the presence of such a clause.

Document 5 does mention that the parties have read this Agreement and all of its Schedules, Exhibits and attachments and agree to be bound by its terms, but it does not explicitly mention a right of first refusal, right of first offer, or right of first negotiation.

Document 2 mentions that this Agreement shall inure solely to the benefit of, and shall be binding upon, the Agent, the Company, the MHC, the Bank, and their respective successors and assigns, and no other person shall have or be construed"
INGEVITYCORP_05_16_2016-EX-10.5-INTELLECTUAL PROPERTY AGREEMENT__Most Favored Nation,"Is there a clause that if a third party gets better terms on the licensing or sale of technology/goods/services described in the contract, the buyer of such technology/goods/services under the contract shall be entitled to those better terms?",0.8787878787878788,0.045454545454545456,0.05172413793103448,1.0,"Based on the provided context documents, there is no explicit clause that states if a third party gets better terms on the licensing or sale of technology/goods/services described in the contract, the buyer of such technology/goods/services under the contract shall be entitled to those better terms.

Document 4, Section 3.1, states that if LICENSEE requires any additional functionality or technology substantially different from those set forth in Exhibit A, D2 shall license such additional functionality or technology to LICENSEE at D2's then best price to its other Licensees. However, this does not mention anything about better terms from a third party.

Document 5, Section 28.3, does mention that Bank of America shall give Supplier notice of, and the Parties shall cooperate in, the defense of any claim, suit or proceeding, including appeals, negotiations and any settlement or compromise thereof. However, this does not include a clause about better terms from a third party.

Document 3, Section 2.1, mentions that the Parties shall strategically cooperate with each other in order to carry out certain joint projects, but it does not mention anything about better terms from a third party.

Document 1, Section 17.6, mentions Force Majeure Event, but it does"
"CARDAX,INC_08_19_2014-EX-10.1-COLLABORATION AGREEMENT__Joint Ip Ownership",Is there any clause providing for joint or shared ownership of intellectual property between the parties to the contract?,0.1206896551724138,0.06896551724137931,0.5714285714285714,0.0,"No, there is no clause providing for joint or shared ownership of intellectual property between the parties to the contract. 

Document 1 describes ownership of intellectual property rights created or developed jointly by the parties, where such rights are owned exclusively by either Skype (in sections 4.2.3.2.1) or the Online Group (in section 4.2.3.2.2). 

Document 3 mentions that the respective rights of members of each group in and to certain data are governed exclusively by certain sections (2.1 or 2.2) and the Intercompany Data Purchase Agreement, but does not discuss joint or shared ownership of intellectual property.

Document 5 explicitly states that the agreement is confidential but is silent on the topic of joint or shared ownership of intellectual property.

Therefore, there is no provision for joint or shared ownership of intellectual property between the parties to the contract."
Cerus Corporation - FIRST AMEND TO SUPPLY AND MANUFACTURING AGREEMENT__Audit Rights,"Does a party have the right to  audit the books, records, or physical locations of the counterparty to ensure compliance with the contract?",0.1702127659574468,0.0425531914893617,0.25,1.0,"Yes, according to Document 2, each Party or its independent auditor has the right to audit the books of account and records of the other Party not more than once per calendar quarter. The audit can be conducted at the premises where the audited Party maintains consolidated books of account, or at any other premises where relevant books of account and/or records are located."
ScansourceInc_20190509_10-Q_EX-10.2_11661422_EX-10.2_Distributor Agreement__Renewal Term,What is the renewal term after the initial term expires? This includes automatic extensions and unilateral extensions with prior notice.,0.058823529411764705,0.04411764705882353,0.75,0.0,"Based on the provided documents, the renewal term after the initial term expires is as follows:

Document 1: 
This Agreement shall renew for successive 1-year periods, after the initial 1 Year Term, if agreed by both parties in writing within 30 days of license expiration.

Document 2 (Section 5.1):
The Agreement shall commence on the Effective Date and remain in full force and effect for an initial term of **** from the Supply Commencement Date of the Product (""Initial Term""). Following the Initial Term, the Agreement shall automatically be renewed for additional periods of **** (each, a ""Renewal Term,"" and, together with the Initial Term, the ""Term""))

Document 3:
This Agreement shall automatically renew for consecutive one (1) year terms at XIMAGE's then prevailing rates at the end of each one (1) year term unless either party gives at least sixty (60) days prior written notice of the non-renewal of this Agreement.

Document 4 (Section 7.2):
Unless otherwise provided in the applicable Facility Addendum, each Facility Addendum shall commence on the Effective Date and shall continue for a period of four (4) years from such date (the ""Initial Term"" of the Facility Addendum),"
HPILHOLDING_01_07_2015-EX-99.1-COOPERATION AGREEMENT__Source Code Escrow,"Is one party required to deposit its source code into escrow with a third party, which can be released to the counterparty upon the occurrence of certain events (bankruptcy,  insolvency, etc.)?",0.0,0.0,0.0,1.0,There is no information in the provided context documents that suggests either party is required to deposit its source code into escrow with a third party.
IMMUNOMEDICSINC_08_07_2019-EX-10.1-PROMOTION AGREEMENT__Notice Period To Terminate Renewal,What is the notice period required to terminate renewal?,0.017241379310344827,0.017241379310344827,1.0,1.0,"According to Document 3, ""Either party may terminate the Agreement on 60-days written notice during a renewed term."""
IMAGEWARESYSTEMSINC_12_20_1999-EX-10.22-MAINTENANCE AGREEMENT__Irrevocable Or Perpetual License,Does the contract contain a  license grant that is irrevocable or perpetual?,0.9358974358974359,0.9358974358974359,1.0,0.0,"Based on the provided context documents, there is no mention of an irrevocable or perpetual license grant. The contract appears to be a standard agreement with a fixed term, as mentioned in various sections (e.g., Section 3.2 Terms of Payment). The term for payment varies, but it implies that the agreement has a specific duration.

However, there are some statements that could be interpreted as limiting the termination of the license grant, but these statements do not guarantee irrevocability or perpetuity. For example:

- Document 3 states that ""Nothing in this Agreement shall obligate Licensee to distribute, exhibit or otherwise use any Title."" This does not necessarily imply that the license grant is irrevocable or perpetual.
- Document 4 mentions that ""Nothing in this Agreement limits or restricts Licensee from entering into any similar agreements with any third party."" This might be seen as giving Licensee some flexibility or freedom to exit the agreement, but it does not explicitly guarantee the perpetuity of the license grant.

Therefore, while the contract does not explicitly state that the license grant is irrevocable or perpetual, it also does not contain any clear language that would terminate the license grant after a specific period."
PcquoteComInc_19990721_S-1A_EX-10.11_6377149_EX-10.11_Co-Branding Agreement2__Non-Transferable License,Does the contract limit the ability of a party to transfer the license being granted to a third party?,1.0,0.06896551724137931,0.06896551724137931,1.0,"According to Document 1, Section 8 (ASSIGNMENT), the contract does limit the ability of a party to transfer the license being granted to a third party. Specifically, it states that ""no rights or obligations hereunder, including but not limited to Licensee's Subscriber accounts, shall be assigned or transferred, in whole or in part, by either of the parties hereto to any person, firm or corporation without prior written consent by the other party...""

However, there is an exception for transfers to an affiliate or in the case of a sale of assets, but this still requires some level of consent or notice to the other party.

Additionally, Document 5, Section 60, further clarifies that the members of the joint venture are independent business entities and will not be jointly or severally liable for the actions of the other members, which implies that a member cannot transfer its rights or obligations to a third party without consent. However, the primary governing provision for the licensing agreement is Document 1, Section 8."
NakedBrandGroupInc_20150731_POS AM (on S-1)_EX-10.75_9196027_EX-10.75_Endorsement Agreement__Document Name,The name of the contract,0.0,0.0,0.0,1.0,"Unfortunately, none of the provided context documents explicitly mention the name of the contract."
PFSFUNDS_06_26_2020-EX-99.H OTH MAT CONT-SERVICES AGREEMENT__Competitive Restriction Exception,"This category includes the exceptions or carveouts to Non-Compete, Exclusivity and No-Solicit of Customers above.",0.016129032258064516,0.016129032258064516,1.0,1.0,"Based on the context provided, it seems that the question is asking for information related to an agreement, specifically about Non-Compete, Exclusivity, and No-Solicit of Customers. However, the category the question is asking for is not explicitly mentioned in the provided documents.

Since there is a Section 10.3 ""UNAUTHORIZED USE"" in Document 5, we might be able to find some clues there. However, this section does not directly answer the question about Non-Compete, Exclusivity, and No-Solicit of Customers.

Given the structure of the documents and the presence of Section 10.3, the closest match to the requested information seems to be Section 10.1 ""NONCOMPETITION"" in Document 5. 

However, according to the provided context, there is no direct answer to the requested information."
SYKESHEALTHPLANSERVICESINC_04_24_1998-EX-10.14-OUTSOURCING AGREEMENT__Uncapped Liability,Is a party’s liability uncapped upon the breach of its obligation in the contract? This also includes uncap liability for a particular type of breach such as IP infringement or breach of confidentiality obligation.,0.4,0.09090909090909091,0.22727272727272727,0.0,"Based on the provided context documents, there is no explicit information that suggests a party's liability is uncapped upon the breach of its obligation in the contract. However, in Document 4, Section 10, Subsection (b), it is mentioned that if payment is made by or on behalf of an Indemnifying Party to an Indemnitee in connection with a Third-Party Claim, the Indemnifying Party shall be subrogated to and shall stand in the place of the Indemnitee. This implies that the Indemnifying Party may be liable to make payments to the Indemnitee, up to the extent of the liabilities assumed by the Indemnifying Party under the contract.

In Document 5, Section 12, the confidentiality obligations are stated to survive the termination of the Agreement for five (5) years after the disclosure of such Confidential Information. However, there is no specific information about the liability limits or caps in case of a breach of confidentiality obligations.

In Document 2, Section 2, if an indemnifying Party assumes the defense of a Claim, it is stated that no compromise or settlement of such claims may be effected by the indemnifying Party without the indemnified Party's consent, unless certain conditions"
EbixInc_20010515_10-Q_EX-10.3_4049767_EX-10.3_Co-Branding Agreement__Affiliate License-Licensee,Does the contract contain a license grant to a licensee (incl. sublicensor) and the affiliates of such licensee/sublicensor?,0.7391304347826086,0.028985507246376812,0.0392156862745098,0.0,"Based on the provided context documents, the contract does contain a license grant to a licensee (including a sublicensor) and the affiliates of such licensee/sublicensor. 

Document 1, Section 2.2, states: ""Licensor hereby grants to Licensee an exclusive in the Territory to (1) make Sublicense Copies and copies of the Documentation to meet the demand of Redistributors and Customers and (2) market and sublicense Sublicense Copies and copies of the Documentation...""

Document 2, Section 2.2 also states: ""(a) TO A REDISTRIBUTOR: To a Redistributor pursuant to a Redistributor Agreement containing substantially the same terms and conditions as are set forth in this Agreement (subject to Section 2.5) and a Sublicense with each Customer of Redistributor in accordance with subsection 2.2(b); or (b) TO CUSTOMERS: Pursuant to a Sublicense signed by the Customer.""

However, Document 4, Section 1.6, defines a ""Redistributor"" as ""any individual or entity that is granted a license by Licensee to copy and sublicense one or more Licensed Products to Customers."" This suggests that the license granted to a licensee (including a sublicensor) includes their"
Cerus Corporation - FIRST AMEND TO SUPPLY AND MANUFACTURING AGREEMENT__Unlimited/All-You-Can-Eat-License,"Is there a clause granting one party an “enterprise,” “all you can eat” or unlimited usage license?",1.0,0.047619047619047616,0.047619047619047616,0.0,"Based on the provided context documents, I do not see any clause granting one party an ""enterprise,"" ""all you can eat,"" or unlimited usage license. In fact, Document 1 and Document 5 both contain restrictions on the usage of intellectual property, with Document 5 specifically stating that ""no member of the Online Group or the Group may in any manner... modify the Skype Software... or distribute... the Skype Software... to any third party"" (emphasis added). However, Document 5 does allow for certain exceptions regarding unaffiliated third-party distributors, but it does not grant an unlimited usage license."
WEBHELPCOMINC_03_22_2000-EX-10.8-HOSTING AGREEMENT__Revenue/Profit Sharing,"Is one party required to share revenue or profit with the counterparty for any technology, goods, or services?",0.0,0.0,0.0,1.0,"Based on the provided context documents, there is no mention of one party sharing revenue or profit with the counterparty for any technology, goods, or services. The documents focus on the agreement's terms and conditions, such as service taxes, force majeure, assignment, and proprietary rights, but do not discuss revenue or profit sharing."
"SOLUTIONSVENDINGINTERNATIONAL,INC_03_31_2020-EX1A-1 UNDR AGMT-SERVICES AGREEMENT__Non-Disparagement",Is there a requirement on a party not to disparage the counterparty?,0.0,0.0,0.0,1.0,There is no explicit requirement in the provided context documents for a party not to disparage the counterparty.
DigitalCinemaDestinationsCorp_20111220_S-1_EX-10.10_7346719_EX-10.10_Affiliate Agreement__Minimum Commitment,Is there a minimum order size or minimum amount or units per-time period that one party must buy from the counterparty under the contract?,0.0,0.0,0.0,1.0,"Based on the provided context documents, there is no information about a minimum order size, minimum amount, or minimum units per-time period that one party must buy from the counterparty under the contract. The documents primarily discuss the terms of the contract, including the sale of shares, the use of proceeds, and the obligations of the parties involved, but do not mention any specific requirements for minimum orders."
INGEVITYCORP_05_16_2016-EX-10.5-INTELLECTUAL PROPERTY AGREEMENT__Competitive Restriction Exception,"This category includes the exceptions or carveouts to Non-Compete, Exclusivity and No-Solicit of Customers above.",0.20967741935483872,0.12903225806451613,0.6153846153846154,1.0,"Based on the provided context documents, I do not have enough information to directly answer the question regarding the exceptions or carveouts to Non-Compete, Exclusivity and No-Solicit of Customers. However, I can provide some relevant information related to non-compete clauses, confidentiality, and exclusivity from Document 5.

Document 5 mentions the non-compete clause in Section 10.1, which states that Licensee shall not engage in any business competing with the Licensed Products during the term of this Agreement. However, I do not find any specific exceptions or carveouts mentioned in this section.

The confidentiality clause in Section 10.2 requires Licensee to maintain the confidentiality of the Licensed Products and related information. It also mentions that certain disclosures, such as those required by law or public disclosure, do not constitute a breach of this section.

Section 10.3 discusses unauthorized use, but it does not provide specific exceptions or carveouts to the non-compete, exclusivity, or no-solicit clauses.

To answer the question accurately, I would need more information or specific context about the exceptions or carveouts to the non-compete, exclusivity, and no-solicit clauses."
AlliedEsportsEntertainmentInc_20190815_8-K_EX-10.34_11788308_EX-10.34_Sponsorship Agreement__Effective Date,The date when the contract is effective ,0.014084507042253521,0.014084507042253521,1.0,0.0,"I don't see the date when the contract is effective in the provided documents. 

However, I can see the date when the Agreement is made effective for Document 4: April 1, 2018."
MEDIWOUNDLTD_01_15_2014-EX-10.6-SUPPLY AGREEMENT__Affiliate License-Licensor,Does the contract contain a license grant by affiliates of the licensor or that includes intellectual property of affiliates of the licensor? ,0.1076923076923077,0.07692307692307693,0.7142857142857143,0.0,"Based on the provided context documents, I cannot determine if the contract includes a license grant by affiliates of the licensor or that includes intellectual property of affiliates of the licensor. Document 2 section 5.2 mentions that if Licensor is not the sole owner of the intellectual property rights, they have been granted by the owner or rightful sub-licensee. However, the context does not explicitly mention a license grant by affiliates of the licensor."
PROLONGINTERNATIONALCORP_03_23_1998-EX-10.16-SPONSORSHIP AGREEMENT__Unlimited/All-You-Can-Eat-License,"Is there a clause granting one party an “enterprise,” “all you can eat” or unlimited usage license?",0.06349206349206349,0.047619047619047616,0.75,0.0,"Based on the provided context documents, there is no direct mention of an ""enterprise,"" ""all you can eat,"" or unlimited usage license.

However, in Document 1, under the definition of ""Competitive Business,"" it talks about a business or enterprise that offers food products similar to those of Pretzel Time Units. But, there is no mention of any specific license granted by Pretzel Time to its competitors.

In Document 5, Section 4.1.4, it talks about ""Reservation of Rights,"" where each party reserves all rights not granted in the Agreement. This implies that neither party grants any unlimited usage license.

However, in Document 2, Section 9.2, it mentions that the Joint Advisory Committee (JAC) can have representatives from both parties, but there is no mention of any unlimited usage license.

In Document 3, Section (d) and (e), it talks about assignment of rights and obligations of the Agreement, but there is no mention of any unlimited usage license.

In Document 4, Section 14.2, it talks about Force Majeure, and in Section 14.3, it emphasizes the independent contractor nature of the relationship between the parties. But, there is no mention of any unlimited usage"
