id,question,relevance_score,utilization_score,completeness_score,adherence_score,response
SPARKLINGSPRINGWATERHOLDINGSLTD_07_03_2002-EX-10.13-SOFTWARE LICENSE AND MAINTENANCE AGREEMENT__Volume Restriction,"Is there a fee increase or consent requirement, etc. if one party’s use of the product/services exceeds certain threshold?",0.0,0.0,0.0,1.0,There is no specific information in the provided context documents regarding a fee increase or consent requirement based on one party's use of the product/services exceeding a certain threshold.
EMERALDHEALTHTHERAPEUTICSINC_06_10_2020-EX-4.5-CONSULTING AGREEMENT - DR. GAETANO MORELLO N.D. INC.__Rofr/Rofo/Rofn,"Is there a clause granting one party a right of first refusal, right of first offer or right of first negotiation to purchase, license, market, or distribute equity interest, technology, assets, products or services?",0.11940298507462686,0.1044776119402985,0.5,0.0,"There is no clear clause granting one party a right of first refusal, right of first offer, or right of first negotiation to purchase, license, market, or distribute equity interest, technology, assets, products, or services in the provided context documents.

Document 1 mentions confidentiality, assignment, and press releases, but does not mention any right of first refusal or offer. 

Document 2 discusses the exclusive agreement among the parties and the rights and obligations of the Agent, but this does not include any mention of a right of first refusal or offer. 

Document 3 also discusses confidentiality, return of materials, and payment, but there is no mention of a right of first refusal or offer in this document. 

Document 4 mentions assignment of rights, force majeure, and export, but does not contain a clause granting a right of first refusal, right of first offer, or right of first negotiation.

Document 5 is the only one of the provided context documents that mentions the transfer of rights. However, it specifies that no rights or obligations can be assigned or transferred without prior written consent, with some exceptions related to affiliates, asset transfers, and specific business transfers. There is no clause granting a right of first refusal, right of first offer, or right of"
"MEDALISTDIVERSIFIEDREIT,INC_05_18_2020-EX-10.1-CONSULTING AGREEMENT__Warranty Duration","What is the duration of any  warranty against defects or errors in technology, products, or services  provided under the contract?",0.04054054054054054,0.013513513513513514,0.3333333333333333,1.0,"Based on the provided context documents, I was unable to determine a specific duration for any warranty against defects or errors in technology, products, or services provided under the contract. 

Document 3 mentions that ""If any Product, Work Product or service furnished under this Agreement, ... becomes, or in Bank of America's or Supplier's reasonable opinion is likely to become, the subject of any claim, suit, or proceeding arising from or alleging facts that if true would constitute infringement, misappropriation or other violation of, ... then Supplier shall promptly notify Bank of America and, at Supplier's expense, Supplier shall take the following actions...""

However, it does not specify the duration of the warranty."
AULAMERICANUNITTRUST_04_24_2020-EX-99.8.77-SERVICING AGREEMENT__Joint Ip Ownership,Is there any clause providing for joint or shared ownership of intellectual property between the parties to the contract?,0.08620689655172414,0.034482758620689655,0.4,0.0,"Based on the provided context documents, there is a clause in Document 1 that describes joint ownership of intellectual property rights in certain cases. 

When the Parties create or develop intellectual property jointly, if such rights comprise (i) predominantly communication software or related communication hardware or other technology, or (ii) user names and other user profile information included within the Company-Skype Branded Application, of Company-Skype Branded Customers, then such rights shall be owned exclusively by Skype."
"GSITECHNOLOGYINC_11_16_2009-EX-10.2-INTELLECTUAL PROPERTY AGREEMENT between SONY ELECTRONICS INC. and GSI TECHNOLOGY, INC.__Non-Compete",Is there a restriction on the ability of a party to compete with the counterparty or operate in a certain geography or business or technology sector? ,0.07142857142857142,0.07142857142857142,1.0,1.0,"Based on the provided context documents, there is a restriction mentioned in Document 5, specifically in the NON-SOLICITATION and NON-CIRCUMVENTION clauses.

In the NON-SOLICITATION clause, it is stated that each Party agrees not to solicit, interfere with, procure or entice away any employee or contractor of the other Party for a period of six (6) months after the Term of this Agreement.

In the NON-CIRCUMVENTION clause, it is stated that both Parties agree not to engage in business dealings, discussions, or otherwise work directly with any third parties introduced to them through the other Party, or to exploit any pre-existing relationship of the other Party with any third party, without the prior consent and/or direct participation of the other Party.

However, there is no explicit restriction mentioned on the ability of a party to compete with the counterparty or operate in a certain geography or business or technology sector."
PerformanceSportsBrandsInc_20110909_S-1_EX-10.10_7220214_EX-10.10_Endorsement Agreement__Ip Ownership Assignment,"Does intellectual property created  by one party become the property of the counterparty, either per the terms of the contract or upon the occurrence of certain events?",0.9622641509433962,0.07547169811320754,0.0784313725490196,0.0,"Based on the provided context documents, the answer is complex and depends on the specific situation.

From Document 2, section 6.1, it is clear that each party acknowledges that the other party's Confidential Information is valuable and unique, and that disclosure of such information without consent will result in irreparable injury to its owner. However, this does not specify ownership of intellectual property created jointly by the parties.

Document 4 provides specific rules for ownership of intellectual property created jointly by the parties. In section 4.2.3.2.1, if the intellectual property constitutes predominantly communication software or related communication hardware, or ""user"" names and other ""user profile"" information, then such rights shall be owned exclusively by Skype. In section 4.2.3.2.2, if the intellectual property comprises data specifically provided to the Group by Customers, then such rights shall be owned exclusively by the Online Group.

Document 5 also discusses licensing intellectual property from a third party, but it does not specify ownership of intellectual property created jointly by Janssen and Company.

Therefore, based on the provided context documents, it appears that intellectual property created jointly by the parties may be owned exclusively by one party, depending on the specific type of intellectual property created. However"
SMITHELECTRICVEHICLESCORP_04_04_2012-EX-10.26-FLEET MAINTENANCE AGREEMENT__Exclusivity,"Is there an exclusive dealing  commitment with the counterparty? This includes a commitment to procure all “requirements” from one party of certain technology, goods, or services or a prohibition on licensing or selling technology, goods or services to third parties, or a prohibition on  collaborating or working with other parties), whether during the contract or  after the contract ends (or both).",0.07792207792207792,0.07792207792207792,1.0,1.0,"Based on the provided context documents, there is no mention of an exclusive dealing commitment between the parties. In fact, Document 1 states that ""Members will not be jointly or severally liable for the actions of the other Members"" and that ""Members will provide services to one another on an arms' length basis while remaining independent business entities."" This suggests that the parties are independent and may work with or provide services to other parties.

Additionally, Document 3 states that ""Nothing in this Agreement shall create or imply an association, partnership, or joint venture between the Parties, it being agreed and understood that the Parties are independent contractors;"" and that ""Neither Party shall have any responsibility for the hiring, termination or compensation of the other Party's employees or for any employee benefits of such employee."" This further supports the idea that the parties are independent and not obligated to exclusively deal with each other.

Therefore, based on the provided context, it appears that there is no exclusive dealing commitment between the parties."
IMAGEWARESYSTEMSINC_12_20_1999-EX-10.22-MAINTENANCE AGREEMENT__Affiliate License-Licensor,Does the contract contain a license grant by affiliates of the licensor or that includes intellectual property of affiliates of the licensor? ,0.15384615384615385,0.03076923076923077,0.2,1.0,"Based on the context documents provided, the answer is no. 

Document 2 mentions that if Licensor is not the sole and exclusive owner of the intellectual property rights to the Content, it has been granted the right to grant the rights provided by Licensor to plan_b. However, there is no mention of affiliates of the Licensor.

Document 5 mentions that the parties agree to maintain the provisions of the Agreement in the strictest confidence, but it does not mention a license grant by affiliates of the Licensor or that includes intellectual property of affiliates of the Licensor."
"BABCOCK_WILCOXENTERPRISES,INC_08_04_2015-EX-10.17-INTELLECTUAL PROPERTY AGREEMENT between THE BABCOCK _ WILCOX COMPANY and BABCOCK _ WILCOX ENTERPRISES, INC.__Competitive Restriction Exception","This category includes the exceptions or carveouts to Non-Compete, Exclusivity and No-Solicit of Customers above.",0.41935483870967744,0.24193548387096775,0.5769230769230769,0.0,"Unfortunately, the provided context documents do not contain enough information to definitively answer the question. There is no mention of a ""Non-Compete, Exclusivity and No-Solicit of Customers"" clause in the documents.

However, based on the provided documents, there is a clause in Document 5, Section 10.1, ""NONCOMPETITION,"" which discusses non-compete restrictions.

Additionally, Document 2 contains certain restrictions on the use of the Software, including clauses related to:

- Transfer, assignment, or sublicense of the license rights
- Error corrections or modifications to the Software
- Decompilation, decryption, reverse engineering, disassembly, or other forms of reverse engineering
- Use for services for third parties without express written authorization

These restrictions can be seen as exceptions or carveouts to certain clauses, but they are not specifically related to non-compete, exclusivity, or no-solicit of customers."
BravatekSolutionsInc_20170418_8-K_EX-10.1_10205739_EX-10.1_Reseller Agreement__Governing Law,Which state/country's law governs the interpretation of the contract?,0.04225352112676056,0.04225352112676056,1.0,1.0,"Based on the provided context documents, particularly Document 1, Document 3, and Document 4, the laws of the State of Delaware govern the interpretation of the contract.

Document 1 states: ""This Agreement shall be governed by, and construed and enforced in accordance with, the internal laws of the State of Delaware without giving effect to any choice of law rule that would cause the application of the laws of any jurisdiction other than the internal laws of the State of Delaware to the rights and duties of the Parties.""

Document 3 reiterates this: ""Section 10.9 Governing Law. This Agreement shall be governed by, and construed and enforced in accordance with, the substantive laws of the State of Delaware, without regard to any conflicts of law provisions thereof that would result in the application of the laws of any other jurisdiction.""

Document 4 also mentions Delaware law, although in a different context: ""...and such opinion [is] to such counsel's Actual Knowledge, compliant in all material respects with the regulations of the OTS in the State of Delaware..."""
ALLIANCEBANCORPINCOFPENNSYLVANIA_10_18_2006-EX-1.2-AGENCY AGREEMENT__Minimum Commitment,Is there a minimum order size or minimum amount or units per-time period that one party must buy from the counterparty under the contract?,0.2,0.04,0.2,0.0,"Based on the provided context documents, there is no information about a minimum order size or minimum amount or units per-time period that one party must buy from the counterparty under the contract.

However, Document 2 mentions that Shares will be sold under the Program generally within one business day of Agent's receipt (on behalf of such banking affiliate) of the sale request, but in no event more than five business days (except where deferral is necessary under state or federal regulations). This implies that there is a time frame for selling shares, but it does not specify a minimum order size or amount.

Document 5 mentions that the purchase price shall be paid in cash at the closing of the purchase, which shall take place no later than ninety (90) days after receipt by Franchisee of Pretzel Time's notice of exercise of this option to purchase the Unit. However, this also does not specify a minimum order size or amount.

Therefore, based on the provided context documents, it is not possible to determine if there is a minimum order size or minimum amount or units per-time period that one party must buy from the counterparty under the contract."
EuromediaHoldingsCorp_20070215_10SB12G_EX-10.B(01)_525118_EX-10.B(01)_Content License Agreement__Anti-Assignment,Is consent or notice required of a party if the contract is assigned to a third party?,0.05952380952380952,0.05952380952380952,1.0,1.0,"Based on the context documents, specifically Document 4 (Section 10.2) and Document 5 (Section 12.12), the answer is that consent or notice is required of a party if the contract is assigned to a third party.

According to Document 4, Section 10.2 states that ""If and to the extent that a Party assigns any of its rights and/or obligations hereunder in accordance with this Section 10.2, then this Agreement shall be binding upon the assignee to the same extent as if it were a Party hereto.""

However, Document 5, Section 12.12 provides more specific details on assignment. It states that ""Neither party shall assign their respective rights under this Agreement without the prior written consent of the other party."" This indicates that consent is required for assignment to a third party.

Additionally, Section 12.12 also provides two exceptions where consent is not required:

* Assignment to an Affiliate, provided the party to this Agreement continues to be liable for all obligations hereunder.
* In connection with a merger or sale of all or substantially all of the assets of such party to which this Agreement relates, provided the successor or assignee assumes all liabilities hereunder.

Therefore, in general, consent or notice is required"
SEASPINEHOLDINGSCORP_10_10_2018-EX-10.1-SUPPLY AGREEMENT__Agreement Date,The date of the contract,0.203125,0.078125,0.38461538461538464,0.0,"Unfortunately, I cannot determine the date of the contract from the provided context documents. However, I can identify a few dates that may be relevant to the contract, but the specific contract date is not explicitly mentioned:

- Document 2 mentions a lease for the Site that must be obtained within sixty (60) days after delivery of Pretzel Time's approval of the Site.
- Document 3 mentions Contract Year 2011 and Contract Year 2012, but the contract date is not specified.
- Document 5 mentions the Agent Launch Date, which is currently anticipated to be March 29, 1999.
- Document 4 mentions a Subscription and Community Offering, but the contract date is not specified.

To determine the date of the contract, I would need more information."
PREMIERBIOMEDICALINC_05_14_2020-EX-10.2-INTELLECTUAL PROPERTY AGREEMENT__Renewal Term,What is the renewal term after the initial term expires? This includes automatic extensions and unilateral extensions with prior notice.,0.08823529411764706,0.08823529411764706,1.0,0.0,"Based on the provided context documents, I can answer the question as follows:

Document 1:
- The Agreement shall renew for successive 1-year periods after the initial 1-year term.
- No specific information about automatic extensions or unilateral extensions with prior notice is mentioned in this document.

Document 2:
- The Agreement shall automatically be renewed for additional periods of **** (Renewal Term).
- The Renewal Term is not specified in this document, but the Initial Term is ****.

Document 3:
- The Agreement shall automatically renew for consecutive one (1)-year terms at XIMAGE's then-prevailing rates.

Document 4:
- The Initial Term is four (4) years from the Effective Date.
- The Agreement may be extended for up to three (3) additional periods of twelve (12) months (Extension Periods).

Document 5:
- This document does not provide information about renewal terms.

Document 1 has no information about automatic extensions or unilateral extensions. Document 3 specifies a one-year automatic renewal term. Document 4 specifies a four-year initial term and three additional periods of twelve months for extension.

To combine the information from all the documents and answer the question, I will make the following assumption:

- The initial term is 1"
"FIDELITYNATIONALINFORMATIONSERVICES,INC_08_05_2009-EX-10.3-INTELLECTUAL PROPERTY AGREEMENT__Non-Transferable License",Does the contract limit the ability of a party to transfer the license being granted to a third party?,0.09195402298850575,0.011494252873563218,0.125,1.0,"According to Document 1, Section 8 (ASSIGNMENT), the contract does limit the ability of a party to transfer the license being granted to a third party. The relevant text states:

""...no rights or obligations hereunder, including but not limited to Licensee's Subscriber accounts, shall be assigned or transferred, in whole or in part, by either of the parties hereto to any person, firm or corporation without prior written consent by the other party, which consent shall not be unreasonably withheld or delayed.""

This implies that any transfer of the license must be approved by the other party, which may limit the ability of a party to transfer the license to a third party."
EcoScienceSolutionsInc_20180406_8-K_EX-10.1_11135398_EX-10.1_Sponsorship Agreement__Uncapped Liability,Is a party’s liability uncapped upon the breach of its obligation in the contract? This also includes uncap liability for a particular type of breach such as IP infringement or breach of confidentiality obligation.,0.6181818181818182,0.07272727272727272,0.11764705882352941,1.0,"The context documents do not explicitly state that a party's liability is uncapped upon the breach of its obligation in the contract. However, the documents do provide some information relevant to liability.

In Document 2 (Section 8.2(b)), it is stated that a Party may give notice of a material breach to the other Party, which Party shall have [**] (or such longer period of time as may be reasonably commensurate with the effort reasonably required to remedy such default) in which to remedy such default. However, there is no mention of liability being uncapped.

In Document 4 (Section 11.1(b)), it is stated that to the extent of the liabilities assumed by Manufacturer under this Agreement, such insurance policies of Manufacturer shall be primary and non-contributing with respect to any other similar insurance policies available to Customer or its Affiliates. This suggests that the liability is not uncapped, as it is subject to the insurance coverage.

In Document 5 (Section 12.5), it is stated that Article 12 will survive the termination of this Agreement, for any item of Confidential Information, for five (5) years after the disclosure of such Confidential Information to the receiving party under this Agreement. However, this does not provide any information"
"ETELOS,INC_03_09_2004-EX-10.8-DISTRIBUTOR AGREEMENT__Liquidated Damages",Does the contract contain a clause that would award either party liquidated damages for breach or a fee upon the termination of a contract (termination fee)?,0.2571428571428571,0.05714285714285714,0.2222222222222222,0.0,"Based on the provided context documents, I do not find any clauses that explicitly award either party liquidated damages for breach or a fee upon the termination of a contract (termination fee).

However, some documents mention provisions that survive termination, such as payments accrued prior to termination (Document 3, Section 15(d)(i)), and the obligation to destroy or return property, materials, or other items of the other party (Document 3, Section 15(d)(ii) and Document 5, Section 15.3.1)."
SPARKLINGSPRINGWATERHOLDINGSLTD_07_03_2002-EX-10.13-SOFTWARE LICENSE AND MAINTENANCE AGREEMENT__Warranty Duration,"What is the duration of any  warranty against defects or errors in technology, products, or services  provided under the contract?",0.0,0.0,0.0,1.0,"Based on the provided context documents, I could not find any specific information regarding the duration of any warranty against defects or errors in technology, products, or services provided under the contract.

However, in Document 3, Section 28.3, it mentions that the parties shall cooperate in the defense of any claim, suit or proceeding, including appeals, negotiations and any settlement or compromise thereof. But there is no specific information regarding the duration of warranty.

In Document 1, there is a provision that deals with the invalidity or unenforceability of any term or provision of the Agreement. However, this provision does not provide any information regarding warranty duration.

If you have any other questions or need further assistance, please let me know."
StampscomInc_20001114_10-Q_EX-10.47_2631630_EX-10.47_Co-Branding Agreement__Revenue/Profit Sharing,"Is one party required to share revenue or profit with the counterparty for any technology, goods, or services?",0.18333333333333332,0.18333333333333332,1.0,1.0,"Based on the context provided, there is no indication that one party is required to share revenue or profit with the counterparty for any technology, goods, or services."
EbixInc_20010515_10-Q_EX-10.3_4049767_EX-10.3_Co-Branding Agreement__License Grant,Does the contract contain a license granted by one party to its counterparty?,1.0,0.04477611940298507,0.04477611940298507,1.0,"Yes, the contract contains licenses granted by one party to its counterparty. 

In Document 2, Section 14.5, it mentions that the rights and remedies of Licensor included in Article 14 shall not be exclusive and are in addition to any other rights and remedies provided by law or equity, indicating that Licensor has certain rights or remedies.

In Document 2, Section 9, it mentions that Licensee ""shall promptly account for and pay to Licensor all amounts due and owing pursuant to the terms of this Agreement and provide Licensor with all outstanding reports due under this Agreement."" This implies that Licensee has some obligations to Licensor under the agreement, suggesting that Licensor has granted a license to Licensee.

In Document 3, Section 3.1, it mentions that ""Parent shall not acquire, and nothing contained herein shall be construed as conferring, by implication, estoppel or otherwise, any license or other right, title or interest in or to such Licensed SpinCo IP or any other Intellectual Property owned by SpinCo or of any of its Group, except for the license granted to Parent pursuant to Section 3.1."" This section explicitly states that there is a license granted from SpinCo to Parent.

In Document 5"
PfHospitalityGroupInc_20150923_10-12G_EX-10.1_9266710_EX-10.1_Franchise Agreement3__Effective Date,The date when the contract is effective ,0.014084507042253521,0.014084507042253521,1.0,1.0,"Based on the documents provided, I can only find information about the effective date of one agreement.

Document 4, the Sponsorship Agreement, states that it is made effective on the 1st day of April, 2018 (""Effective Date"")."
PelicanDeliversInc_20200211_S-1_EX-10.3_11975895_EX-10.3_Development Agreement2__Notice Period To Terminate Renewal,What is the notice period required to terminate renewal?,0.8448275862068966,0.017241379310344827,0.02040816326530612,1.0,"According to Document 3, the notice period required to terminate a renewed term of the Agreement is 60 days in writing."
BANGIINC_05_25_2005-EX-10-Premium Managed Hosting Agreement__Insurance,Is there a requirement for insurance that must be maintained by one party for the benefit of the counterparty?,0.1724137931034483,0.11494252873563218,0.6666666666666666,1.0,"Yes, in Document 2, Section 26.2, it is stated that the Supplier shall secure and continuously maintain certain insurance, including:

- Worker's Compensation Insurance (Section 26.2.1)
- Employers' Liability Insurance (Section 26.2.2)
- Commercial General Liability Insurance (Section 26.2.3)
- Business Automobile Liability Insurance (Section 26.2.4)
- Excess coverage (Section 26.2.5)

This insurance is to be maintained for the benefit of Bank of America, and Bank of America is to be named as an ""Additional Insured"" to coverages described in Sections 26.2.3, 26.2.4, and 26.2.5.

Similarly, in Document 3, Section 11, Sabco is required to provide spectator liability insurance in an amount not less than $1 million single limit coverage for the benefit of Prolong."
